result_id,cve,name,cvss,correlation_risk,cvss_diff
245bfe1d-0a78-483a-8870-c36395ad5854,N/A,SSL/TLS: Certificate Expired,5.0,47.24672474791578,42.24672474791578
517e62a9-1e4a-422a-af99-9099144c2200,N/A,SSL/TLS: Certificate Expired,5.0,47.24672474791578,42.24672474791578
b6a8450d-cfaa-4f8e-8f13-4dd83ee7b9da,N/A,awiki <= 20100125 Multiple LFI Vulnerabilities - Active Check,5.0,47.24672474791578,42.24672474791578
f14b576d-078f-4529-853f-4a7815e463c1,CVE-2011-1473,"SSL/TLS: Renegotiation DoS Vulnerability (CVE-2011-1473, CVE-2011-5094)",5.0,47.24672474791578,42.24672474791578
2dfb6483-b793-4685-a485-2cf8fe42e368,CVE-2011-1473,"SSL/TLS: Renegotiation DoS Vulnerability (CVE-2011-1473, CVE-2011-5094)",5.0,47.24672474791578,42.24672474791578
88bcc59b-4fc3-4d29-b1be-677c3d0bc950,N/A,Check if Mailserver answer to VRFY and EXPN requests,5.0,47.24672474791578,42.24672474791578
9805f972-8c6b-47ee-bfb8-14360fbce2ea,CVE-1999-0678,/doc directory browsable,5.0,47.24672474791578,42.24672474791578
46cc8541-84e2-40d0-9c66-0f490892427a,CVE-2005-0283,QWikiwiki directory traversal vulnerability,5.0,47.24672474791578,42.24672474791578
7adca992-3b37-455d-9c52-b3761c8820be,CVE-2008-0149,phpinfo() Output Reporting (HTTP),5.3,47.24672474791578,41.94672474791578
f85abd95-b322-4e16-8b41-5db33db0e8c9,CVE-1999-0497,Anonymous FTP Login Reporting,6.4,47.24672474791578,40.84672474791578
9c9163c8-aa0a-4b3b-9efc-924fa75cf2f6,CVE-1999-0501,FTP Brute Force Logins Reporting,7.5,47.24672474791578,39.74672474791578
6c6a10d5-5251-4071-be70-1d418672b476,CVE-2011-3556,Java RMI Server Insecure Default Configuration RCE Vulnerability,7.5,47.24672474791578,39.74672474791578
6e46dd9c-dd8e-4a9e-a622-3e3ea4872e6a,CVE-1999-0501,FTP Brute Force Logins Reporting,7.5,47.24672474791578,39.74672474791578
109f960b-90b0-4896-822b-fb9b2870d87f,CVE-2012-1823,PHP-CGI-based setups vulnerability when parsing query string parameters from php files.,7.5,47.24672474791578,39.74672474791578
26feccf6-99fe-4df3-953d-fd8817f104d8,N/A,Test HTTP dangerous methods,7.5,47.24672474791578,39.74672474791578
8ededf26-52cf-47de-bbfb-ec5445d153c4,CVE-2010-2075,UnrealIRCd Backdoor,7.5,47.24672474791578,39.74672474791578
b1874ba8-2e80-4fcc-8263-f66d01e2a953,N/A,Riello NetMan 204 Default Credentials (SSH),7.5,47.24672474791578,39.74672474791578
84664688-c02c-4191-b592-02b577591b62,N/A,VNC Brute Force Login,9.0,47.24672474791578,38.24672474791578
92984659-8363-4927-9b6e-97b7f4a6d25e,N/A,PostgreSQL Default Credentials (PostgreSQL Protocol),9.0,47.24672474791578,38.24672474791578
5fdc5268-af78-4cda-9413-9b224fc18b39,CVE-1999-0501,SSH Brute Force Logins With Default Credentials Reporting,9.8,47.24672474791578,37.44672474791578
f7824209-2f0d-4757-a2d9-c1dbdf7d5a3a,CVE-2011-2523,vsftpd Compromised Source Packages Backdoor Vulnerability,9.8,47.24672474791578,37.44672474791578
6ac14dfe-b457-4adb-9d18-1894e1dd7b73,CVE-2011-2523,vsftpd Compromised Source Packages Backdoor Vulnerability,9.8,47.24672474791578,37.44672474791578
1b54f37f-566d-4281-a2bd-d857187cbf6c,CVE-2001-0645,MySQL / MariaDB Default Credentials (MySQL Protocol),9.8,47.24672474791578,37.44672474791578
6e431d67-f731-4322-b4ac-44d294d8e399,N/A,Possible Backdoor: Ingreslock,10.0,47.24672474791578,37.24672474791578
3ea1cbf1-2cfd-40cb-ac15-48633febfde5,CVE-1999-0618,The rexec service is running,10.0,47.24672474791578,37.24672474791578
de6ccd58-ace4-4ed5-b59b-5fa9d9f8c8c4,N/A,Operating System (OS) End of Life (EOL) Detection,10.0,47.24672474791578,37.24672474791578
ca4a5b09-2ee5-4f5e-9555-90b0169a4850,CVE-2008-5304,TWiki XSS and Command Execution Vulnerabilities,10.0,47.24672474791578,37.24672474791578
6a89dea2-d49d-4110-978c-d8cbc96a6a23,N/A,Distributed Ruby (dRuby/DRb) Multiple Remote Code Execution Vulnerabilities,10.0,47.24672474791578,37.24672474791578
ea567648-7eca-4757-b5b2-ec8d7b3eae8c,N/A,rlogin Passwordless Login,10.0,47.24672474791578,37.24672474791578
743ed47e-0a31-4110-a197-14bb108d55b9,CVE-1999-0651,The rlogin service is running,7.5,44.45444331531397,36.95444331531397
8e1f8658-2683-48bc-960f-c7bebb362cdb,CVE-1999-0651,rsh Unencrypted Cleartext Login,7.5,44.45444331531397,36.95444331531397
a6df0cdb-5e56-4def-ba4d-267ccd05b390,CVE-2020-1938,Apache Tomcat AJP RCE Vulnerability (Ghostcat),9.8,44.45444331531397,34.65444331531397
29e0cfb9-b702-47ef-aed7-21c73b7bb6d5,N/A,Weak Encryption Algorithm(s) Supported (SSH),4.3,25.137219367610854,20.837219367610853
ef3c3e26-9a96-4b28-be93-d65c4be9fa2d,CVE-2010-4480,phpMyAdmin 'error.php' Cross Site Scripting Vulnerability,4.3,25.137219367610854,20.837219367610853
af06bb4a-53e1-4f18-9f00-b5157ad746c0,CVE-2012-0053,Apache HTTP Server 'httpOnly' Cookie Information Disclosure Vulnerability,4.3,25.137219367610854,20.837219367610853
91d9dca6-bd10-480f-a39a-519278b76a88,CVE-2011-4969,jQuery < 1.6.3 XSS Vulnerability,4.3,25.137219367610854,20.837219367610853
7dbd7149-45b8-4ad2-9c9a-c4fb78a76382,CVE-2015-0204,SSL/TLS: RSA Temporary Key Handling 'RSA_EXPORT' Downgrade Issue (FREAK),4.3,25.137219367610854,20.837219367610853
52b2ed6e-97a5-4a80-8c47-7945c1fc8580,N/A,VNC Server Unencrypted Data Transmission,4.8,25.137219367610854,20.337219367610853
c662a9e2-ad84-4219-9e3f-47d417523cba,N/A,Telnet Unencrypted Cleartext Login,4.8,25.137219367610854,20.337219367610853
ce6e6f1c-c788-4b74-a151-450753cdd6e6,N/A,FTP Unencrypted Cleartext Login,4.8,25.137219367610854,20.337219367610853
a97685ed-df6a-4dbe-a247-086ed20e1421,N/A,Cleartext Transmission of Sensitive Information via HTTP,4.8,25.137219367610854,20.337219367610853
ecb468cd-6e22-49ba-b796-8a109e1be9e5,N/A,FTP Unencrypted Cleartext Login,4.8,25.137219367610854,20.337219367610853
2fbf3057-f832-42e4-ac87-635e6e15f071,CVE-2011-3389,SSL/TLS: Deprecated TLSv1.0 and TLSv1.1 Protocol Detection,4.3,23.65160970298504,19.35160970298504
01f2e3eb-ff3f-45ba-bd5a-89f6b7df0844,CVE-2011-3389,SSL/TLS: Deprecated TLSv1.0 and TLSv1.1 Protocol Detection,4.3,23.65160970298504,19.35160970298504
2bde6508-ba04-4320-b8e8-13b2716ad7b1,CVE-2003-1567,HTTP Debugging Methods (TRACE/TRACK) Enabled,5.8,25.137219367610854,19.337219367610853
37595e97-b48d-4adc-b2db-663db6d7ef8b,CVE-2009-1339,TWiki Cross-Site Request Forgery Vulnerability,6.0,25.137219367610854,19.137219367610854
ef5a66ec-b1f0-4b32-98b5-4e0cd8ed6c2b,CVE-2007-2447,Samba MS-RPC Remote Shell Command Execution Vulnerability - Active Check,6.0,25.137219367610854,19.137219367610854
96c94579-80f9-4768-b450-e805e4022ad8,CVE-2018-20212,TWiki < 6.1.0 XSS Vulnerability,6.1,25.137219367610854,19.037219367610852
f87c01fc-be69-4440-9183-e0f6b0cd73c7,CVE-2012-6708,jQuery < 1.9.0 XSS Vulnerability,6.1,25.137219367610854,19.037219367610852
5c899fc7-1890-47a5-9c7e-1c2000d913f1,CVE-2009-4898,TWiki Cross-Site Request Forgery Vulnerability (Sep 2010),6.8,25.137219367610854,18.337219367610853
c804c8f3-9a31-4717-8fb3-712a7393fb70,CVE-2004-2687,DistCC RCE Vulnerability (CVE-2004-2687),9.3,25.137219367610854,15.837219367610853
e9c059c6-07a7-49a7-98d6-0642fbd36897,N/A,Weak MAC Algorithm(s) Supported (SSH),2.6,15.427501958503115,12.827501958503115
41046833-a2bf-4ce7-874d-503e1341f533,N/A,TCP Timestamps Information Disclosure,2.6,15.427501958503115,12.827501958503115
a449396c-f399-457c-8037-ae8a0a85c413,CVE-2015-4000,SSL/TLS: 'DHE_EXPORT' Man in the Middle Security Bypass Vulnerability (LogJam),3.7,14.515736592755601,10.815736592755602
6805811c-c6df-44e9-bb03-89395ffcf9fc,CVE-2013-2566,SSL/TLS: Report Weak Cipher Suites,5.9,14.515736592755601,8.615736592755601
2b702077-0d4f-4a2d-b0d5-2fdedd76badf,CVE-2013-2566,SSL/TLS: Report Weak Cipher Suites,5.9,14.515736592755601,8.615736592755601
c585fda0-05ae-4edc-948f-73eeaba13b16,CVE-2016-0800,SSL/TLS: Deprecated SSLv2 and SSLv3 Protocol Detection,5.9,14.515736592755601,8.615736592755601
7483c2b9-500a-4588-8a81-f9b7a3d4ff24,CVE-2016-0800,SSL/TLS: Deprecated SSLv2 and SSLv3 Protocol Detection,5.9,14.515736592755601,8.615736592755601
cf3935d5-5230-44b2-8f00-271dc83ab591,CVE-1999-0524,ICMP Timestamp Reply Information Disclosure,2.1,10.524579735228073,8.424579735228074
4a23c036-ad89-4370-ba49-3660aa3fa540,CVE-1999-0524,ICMP Timestamp Reply Information Disclosure,2.1,10.524579735228073,8.424579735228074
a311d03c-2432-4665-b14e-0c1a6c89d45a,CVE-2016-7144,UnrealIRCd Authentication Spoofing Vulnerability,8.1,15.427501958503115,7.327501958503115
cb96dce8-d433-431f-bbd6-62e3b7832b5e,CVE-2014-0224,SSL/TLS: OpenSSL CCS Man in the Middle Security Bypass Vulnerability,7.4,14.515736592755601,7.115736592755601
fffc4a0f-29c6-47c5-b3ce-29adc983d814,CVE-2014-3566,SSL/TLS: SSLv3 Protocol CBC Cipher Suites Information Disclosure Vulnerability (POODLE),3.4,7.7229745968930805,4.322974596893081
4cdd9259-d191-4814-bd47-68f1e9a69f48,CVE-2014-3566,SSL/TLS: SSLv3 Protocol CBC Cipher Suites Information Disclosure Vulnerability (POODLE),3.4,7.7229745968930805,4.322974596893081
cee48645-492a-41e8-9c77-e5c5ab1409f3,N/A,SSL/TLS: Diffie-Hellman Key Exchange Insufficient DH Group Strength Vulnerability,4.0,8.208071630240271,4.208071630240271
dabdf9c1-bae9-4a7b-893f-794141b0dab5,N/A,SSL/TLS: Diffie-Hellman Key Exchange Insufficient DH Group Strength Vulnerability,4.0,8.208071630240271,4.208071630240271
22625329-ab87-4b61-9b54-e6819cca55be,N/A,SSL/TLS: Certificate Signed Using A Weak Signature Algorithm,4.0,8.208071630240271,4.208071630240271
beb1fc3e-6a05-4d8d-a4ce-09064f3f93d9,N/A,SSL/TLS: Certificate Signed Using A Weak Signature Algorithm,4.0,8.208071630240271,4.208071630240271
0d55f6da-f7b7-4dc1-a8b2-3d5a9209c56b,N/A,Weak Key Exchange (KEX) Algorithm(s) Supported (SSH),5.3,8.20807163024027,2.9080716302402694
b7f7c83b-f07b-4717-8bf2-fae2ffa249fb,N/A,SSL/TLS: Server Certificate / Certificate in Chain with RSA keys less than 2048 bits,5.3,8.20807163024027,2.9080716302402694
6d844453-23a0-4580-a68b-28eb1cf61b43,N/A,SSL/TLS: Server Certificate / Certificate in Chain with RSA keys less than 2048 bits,5.3,8.20807163024027,2.9080716302402694
5a80978c-6514-464c-8f6e-f85824470e9d,N/A,Weak Host Key Algorithm(s) (SSH),5.3,8.20807163024027,2.9080716302402694
